{
  "candidate_id": "fixture_run",
  "delivery_claim_ceiling": "lab",
  "human_gate_open": false,
  "quality_target": "premium",
  "reports": {
    "animation_principles": {
      "path": "reports/animation_principles.json",
      "sha256": "69ddafdbb63d3e25cda6853869ce25b8584ba66b4690351f6727496e27ec9d50",
      "subject_sha256": "945c57875945007f7a5a914466221ff84b8182455b49e1e226ad916c874aa3dc"
    },
    "art_direction": {
      "path": "reports/art_direction.json",
      "sha256": "15ff34ba96dbd1b0ceaff7f2e09c2d76f8d02c7a24839cc0393119f2a622562a",
      "subject_sha256": "945c57875945007f7a5a914466221ff84b8182455b49e1e226ad916c874aa3dc"
    },
    "blind_visual_review": {
      "path": "reports/blind_visual_review.json",
      "sha256": "5770c41c318bf3e1c2432392648d27517583b5645ede873473a1c23f076fff14",
      "subject_sha256": "945c57875945007f7a5a914466221ff84b8182455b49e1e226ad916c874aa3dc"
    },
    "fidelity": {
      "path": "reports/fidelity.json",
      "sha256": "20a7befedefe1fcb9be2056b925434651e9c5ee286455d06093dac9ed88d28d1",
      "subject_sha256": "945c57875945007f7a5a914466221ff84b8182455b49e1e226ad916c874aa3dc"
    },
    "human_decision": {
      "path": "reports/human_decision.json",
      "sha256": "3b9420c863e645e6f249ed1dbe4b8d43694402245a1d87b2eff365ddbff9e9a2",
      "subject_sha256": "945c57875945007f7a5a914466221ff84b8182455b49e1e226ad916c874aa3dc"
    },
    "sprite_artifact": {
      "path": "reports/sprite_artifact.json",
      "sha256": "02dc9d54d6317322c457eb5e1d46d690b787e8cf52ef8676067810874a078623",
      "subject_sha256": "945c57875945007f7a5a914466221ff84b8182455b49e1e226ad916c874aa3dc"
    }
  },
  "requested_claim": "technical_candidate",
  "schema_version": "1.1.0",
  "strips": [
    {
      "artifact_report": {
        "path": "reports/strip_validation.json",
        "sha256": "fadb128cf0bc7db419cdff1b7bf937add625d9cb57706333b2d8f370899e5e9b",
        "subject_sha256": "945c57875945007f7a5a914466221ff84b8182455b49e1e226ad916c874aa3dc"
      },
      "contract": {
        "path": "contracts/run_strip_contract.json",
        "sha256": "c5abba02c4753205625dcc999080c3974cc040bdd4e778c3809ebe7f983e0799",
        "subject_sha256": "945c57875945007f7a5a914466221ff84b8182455b49e1e226ad916c874aa3dc"
      },
      "motion_report": {
        "path": "reports/motion_validation.json",
        "sha256": "baa1d064ba2bb4d3e23f0a83915c76553075d351e96a5e08282bff01060f53b7",
        "subject_sha256": "945c57875945007f7a5a914466221ff84b8182455b49e1e226ad916c874aa3dc"
      }
    }
  ],
  "validator_fixture": true
}
